id;name_customer;address;phone;email;note_customer
1;Департамент сельскогохозяйства Белгородской области;г. Белгород, ул. Центральная, д.10;7 472-578-54-78;belapk@bel.ru;
2;Министерство сельского хозяйства Московской области;г.Москва, Орликов переулок д.1;7 495-898-11-87;info@msx.ru;
3;"Агрохолдинг ""Нива""";Воронежская область, с.Быстрое, ул. Академическая, д.8;7 448-455-53-90;agroniva@mail.ru;
4;"ИП ""Рассвет""";г. Белгород, ул.Совхозная, д.67;7 472-656-75-78;rass@vet.com;
5;"ООО ""Веселые ребята""";г.Архангельск, ул.Ломоносова, д.9;7 456-668-85-46;ves@friends.ru;
6;"ОАО ""Птицефабрика ""Перо""";г.Петрозаводск, с.Кременье;7 495-547-74-57;pero@ptiz.ru;
